{
 "schema_version": "1.0",
 "shot_id": "G5-24",
 "axis": "G5",
 "duration_s": 5,
 "aspect": "9:16",
 "resolution": "768P",
 "prompt": "红衣女子先背对镜头站在桥头，然后转身面向镜头走来，转身前后是同一个人，黄昏光线",
 "seed": 41024,
 "characters": [
  {
   "char_id": "charA",
   "desc": "25岁亚洲女性「林夏」，齐肩黑色直发，红色连衣裙，气质温和，单人定妆照",
   "ref_image": "..\\数据\\references_api\\charA_linxia_red_dress.png"
  }
 ],
 "audio": {
  "generate": true
 },
 "engine_hint": {
  "preferred": "api",
  "model": "MiniMax-H3"
 }
}